,Title,URL,Channel,Views,Uploaded,Description,Thumbnail
0,Akshay Kumar x Harsh Gujral | Roast Standup Comedy,https://www.youtube.com/watch?v=FtDv-L1stdo,Harsh gujral,4.3M views,1 day ago,Witness this amazing banter between The Khiladi of all time and Anari. I have never thought I would get a chance to share the stage with Akshay Sir this is a dream come true moment. So enjoy...,https://i.ytimg.com/vi/FtDv-L1stdo/hqdefault.jpg?sqp=-oaymwEcCPYBEIoBSFXyq4qpAw4IARUAAIhCGAFwAcABBg==&rs=AOn4CLC48E9ugtWXt4fge1sPM00MbRGO4g
1,Dhinchak Pooja Papa Ki Pari - Try Not To Laugh vs My Brother,https://www.youtube.com/watch?v=w8LXV8-r9ek,Triggered Insaan,3.1M views,1 day ago,Today we have @FukraInsaan with us and we are watching some funny memes in this try not to laugh challenge. Instagram ► https://www.instagram.com/triggeredinsaan Facebook ► https://www.facebo...,https://i.ytimg.com/vi/w8LXV8-r9ek/hqdefault.jpg?sqp=-oaymwEcCPYBEIoBSFXyq4qpAw4IARUAAIhCGAFwAcABBg==&rs=AOn4CLD-_1C6BgP7HhI8Dgmqd9FKcOUo7g
2,Brother Vs Sister Roblox Challenge,https://www.youtube.com/watch?v=S4dShKZqqDc,Mythpat,1.1M views,1 day ago,Today I challenge my sister in Roblox. #Roblox is a fun free game! This game is also available on Android and its free to download! My sister plays this game on her Android Tab everyday and...,
3,"SPLIT or STEAL for Rs10,00,000 Challenge",https://www.youtube.com/watch?v=KSzMBdnYZjU,Fukra Insaan,1.5M views,22 hours ago,Follow me on Instagram for updates ➞ https://instagram.com/fukra_insaan?igshid=jytojomgh8j4 Join my discord server ➞https://discord.gg/Es7PVh4BAK My second youtube channel ➞ https://youtub...,
4,100 STREAK CHALLENGE IN FREE FIRE || AJJUBHAI & TONDE GAMER REACTION || DESI GAMERS,https://www.youtube.com/watch?v=l6ArV0o5eYY,Desi Gamers,1.5M views,1 day ago,100 STREAK CHALLENGE IN FREE FIRE AJJUBHAI TOTAL GAMING & TONDE GAMER REACTION iss video me main apna cs rank ko main 50 to 100 ka seak kar raha hun with biraj smarty and gaming freak ...,
5,How to Move on in 7 Days | Harsh Beniwal,https://www.youtube.com/watch?v=AhvWahoV8D8,Harsh Beniwal,2.7M views,1 day ago,Download Zupee and Win Real Cash Instantly: https://zupee-creator.onelink.me/TF3p?af_xp=custom&pid=influencer_campaigns&c=Aug&af_adset=TheHarshBeniwal&af_click_lookback=7d Get Rs15 Sign-up...,
6,Imtiaz Jaleel | पुलिस कमिश्नर से मुलाक़ात के बाद क्या बोले उलेमा और इम्तियाज़ जलील,https://www.youtube.com/watch?v=gq4ME_XDUwU,Loknyay Hind,288K views,2 days ago,Ulema and Imtiaz Jalil say after meeting the Police कमिश्नर - Aurangabad News,
7,Trade Fair me maja aagya with friends 😍,https://www.youtube.com/watch?v=qaQICPm_KhE,Sahil joshi Vlogs,353K views,1 day ago,My Instagram = https://www.instagram.com/official_sahiljoshi/ My second channel = https://youtu.be/ErIbwNHqYQg My Facebook = https://www.facebook.com/profile.php?id=61564383777461&mibextid=LQQJ4d,
8,IGL POV SOLO 8 KILLS 🔥🔥 | TEAM Z,https://www.youtube.com/watch?v=QwFRMVIJstE,Scout,235K views,21 hours ago,Don't forget to Like & Share the video and make sure to Subscribe to the Channel ❤️ • Scout's Social Media Handles: • 📷 Instagram: https://www.instagram.com/scoutop 🕊️ Twitter:...,
9,GRANNY DOOR ESCAPE | GRANNY,https://www.youtube.com/watch?v=r7vQKjuZYqk,Total Gaming,509K views,1 day ago,GRANNY DOOR ESCAPE (HORROR GAMEPLAY) GRANNY CHAPTER 1 📷 Instagram: https://www.instagram.com/totalgaming_official/ 🕊️Twitter:- https://twitter.com/total_gaming093 👍 Facebook: https://fa...,
